[
  {
    "id": "dairy",
    "name": {
      "en": "Dairy",
      "de": "Milchprodukte"
    },
    "parent_id": null,
    "flags": [
      "dairy"
    ],
    "aisle": {
      "en": "Chilled & dairy",
      "de": "Kühlregal & Milchprodukte"
    }
  },
  {
    "id": "cow-milk",
    "name": {
      "en": "Cow's milk",
      "de": "Kuhmilch"
    },
    "parent_id": "dairy",
    "flags": [
      "lactose"
    ],
    "aisle": {
      "en": "Chilled & dairy",
      "de": "Kühlregal & Milchprodukte"
    }
  },
  {
    "id": "whole-milk",
    "name": {
      "en": "Whole milk",
      "de": "Vollmilch"
    },
    "parent_id": "cow-milk",
    "flags": [],
    "aisle": {
      "en": "Chilled & dairy",
      "de": "Kühlregal & Milchprodukte"
    }
  },
  {
    "id": "skim-milk",
    "name": {
      "en": "Skimmed milk",
      "de": "Magermilch"
    },
    "parent_id": "cow-milk",
    "flags": [],
    "aisle": {
      "en": "Chilled & dairy",
      "de": "Kühlregal & Milchprodukte"
    }
  },
  {
    "id": "goat-milk",
    "name": {
      "en": "Goat's milk",
      "de": "Ziegenmilch"
    },
    "parent_id": "dairy",
    "flags": [
      "lactose"
    ],
    "aisle": {
      "en": "Chilled & dairy",
      "de": "Kühlregal & Milchprodukte"
    }
  },
  {
    "id": "cheese",
    "name": {
      "en": "Cheese",
      "de": "Käse"
    },
    "parent_id": "dairy",
    "flags": [],
    "aisle": {
      "en": "Chilled & dairy",
      "de": "Kühlregal & Milchprodukte"
    }
  },
  {
    "id": "parmesan",
    "name": {
      "en": "Parmesan with animal rennet",
      "de": "Parmesan mit tierischem Lab"
    },
    "parent_id": "cheese",
    "flags": [
      "animal-rennet",
      "rennet-non-halal",
      "rennet-non-kosher"
    ],
    "aisle": {
      "en": "Chilled & dairy",
      "de": "Kühlregal & Milchprodukte"
    }
  },
  {
    "id": "vegetarian-hard-cheese",
    "name": {
      "en": "Hard cheese with microbial rennet",
      "de": "Hartkäse mit mikrobiellem Lab"
    },
    "parent_id": "cheese",
    "flags": [],
    "aisle": {
      "en": "Chilled & dairy",
      "de": "Kühlregal & Milchprodukte"
    }
  },
  {
    "id": "feta",
    "name": {
      "en": "Feta with microbial rennet",
      "de": "Feta mit mikrobiellem Lab"
    },
    "parent_id": "cheese",
    "flags": [
      "lactose"
    ],
    "aisle": {
      "en": "Chilled & dairy",
      "de": "Kühlregal & Milchprodukte"
    }
  },
  {
    "id": "halloumi",
    "name": {
      "en": "Halloumi with microbial rennet",
      "de": "Halloumi mit mikrobiellem Lab"
    },
    "parent_id": "cheese",
    "flags": [
      "lactose"
    ],
    "aisle": {
      "en": "Chilled & dairy",
      "de": "Kühlregal & Milchprodukte"
    }
  },
  {
    "id": "cream-cheese",
    "name": {
      "en": "Cream cheese",
      "de": "Frischkäse"
    },
    "parent_id": "cheese",
    "flags": [
      "lactose"
    ],
    "aisle": {
      "en": "Chilled & dairy",
      "de": "Kühlregal & Milchprodukte"
    }
  },
  {
    "id": "mozzarella",
    "name": {
      "en": "Mozzarella with microbial rennet",
      "de": "Mozzarella mit mikrobiellem Lab"
    },
    "parent_id": "cheese",
    "flags": [
      "lactose"
    ],
    "aisle": {
      "en": "Chilled & dairy",
      "de": "Kühlregal & Milchprodukte"
    }
  },
  {
    "id": "yogurt",
    "name": {
      "en": "Plain yogurt",
      "de": "Naturjoghurt"
    },
    "parent_id": "dairy",
    "flags": [
      "lactose"
    ],
    "aisle": {
      "en": "Chilled & dairy",
      "de": "Kühlregal & Milchprodukte"
    }
  },
  {
    "id": "butter",
    "name": {
      "en": "Butter",
      "de": "Butter"
    },
    "parent_id": "dairy",
    "flags": [
      "lactose"
    ],
    "aisle": {
      "en": "Chilled & dairy",
      "de": "Kühlregal & Milchprodukte"
    }
  },
  {
    "id": "cream",
    "name": {
      "en": "Double cream",
      "de": "Sahne"
    },
    "parent_id": "dairy",
    "flags": [
      "lactose"
    ],
    "aisle": {
      "en": "Chilled & dairy",
      "de": "Kühlregal & Milchprodukte"
    }
  },
  {
    "id": "nuts",
    "name": {
      "en": "All nuts and peanuts",
      "de": "Alle Nüsse und Erdnüsse"
    },
    "parent_id": null,
    "flags": [
      "nuts"
    ],
    "aisle": {
      "en": "Pantry",
      "de": "Vorrat"
    }
  },
  {
    "id": "tree-nuts",
    "name": {
      "en": "Tree nuts",
      "de": "Schalenfrüchte"
    },
    "parent_id": "nuts",
    "flags": [
      "tree-nuts"
    ],
    "aisle": {
      "en": "Pantry",
      "de": "Vorrat"
    }
  },
  {
    "id": "almonds",
    "name": {
      "en": "Almonds",
      "de": "Mandeln"
    },
    "parent_id": "tree-nuts",
    "flags": [
      "almonds"
    ],
    "aisle": {
      "en": "Pantry",
      "de": "Vorrat"
    }
  },
  {
    "id": "walnuts",
    "name": {
      "en": "Walnuts",
      "de": "Walnüsse"
    },
    "parent_id": "tree-nuts",
    "flags": [
      "walnuts"
    ],
    "aisle": {
      "en": "Pantry",
      "de": "Vorrat"
    }
  },
  {
    "id": "pistachios",
    "name": {
      "en": "Pistachios",
      "de": "Pistazien"
    },
    "parent_id": "tree-nuts",
    "flags": [
      "pistachios"
    ],
    "aisle": {
      "en": "Pantry",
      "de": "Vorrat"
    }
  },
  {
    "id": "cashews",
    "name": {
      "en": "Cashews",
      "de": "Cashewkerne"
    },
    "parent_id": "tree-nuts",
    "flags": [
      "cashews"
    ],
    "aisle": {
      "en": "Pantry",
      "de": "Vorrat"
    }
  },
  {
    "id": "almond-flour",
    "name": {
      "en": "Ground almonds",
      "de": "Gemahlene Mandeln"
    },
    "parent_id": "almonds",
    "flags": [],
    "aisle": {
      "en": "Pantry",
      "de": "Vorrat"
    }
  },
  {
    "id": "peanuts",
    "name": {
      "en": "Peanuts",
      "de": "Erdnüsse"
    },
    "parent_id": "nuts",
    "flags": [
      "peanuts"
    ],
    "aisle": {
      "en": "Pantry",
      "de": "Vorrat"
    }
  },
  {
    "id": "peanut-butter",
    "name": {
      "en": "Unsweetened peanut butter",
      "de": "Ungesüßtes Erdnussmus"
    },
    "parent_id": "peanuts",
    "flags": [],
    "aisle": {
      "en": "Pantry",
      "de": "Vorrat"
    }
  },
  {
    "id": "sesame",
    "name": {
      "en": "Sesame seeds",
      "de": "Sesam"
    },
    "parent_id": null,
    "flags": [
      "sesame"
    ],
    "aisle": {
      "en": "Pantry",
      "de": "Vorrat"
    }
  },
  {
    "id": "tahini",
    "name": {
      "en": "Tahini",
      "de": "Tahin"
    },
    "parent_id": "sesame",
    "flags": [],
    "aisle": {
      "en": "Pantry",
      "de": "Vorrat"
    }
  },
  {
    "id": "sesame-oil",
    "name": {
      "en": "Toasted sesame oil",
      "de": "Geröstetes Sesamöl"
    },
    "parent_id": "sesame",
    "flags": [],
    "aisle": {
      "en": "Pantry",
      "de": "Vorrat"
    }
  },
  {
    "id": "soy",
    "name": {
      "en": "Soy foods",
      "de": "Sojaprodukte"
    },
    "parent_id": null,
    "flags": [
      "soy"
    ],
    "aisle": {
      "en": "Pantry",
      "de": "Vorrat"
    }
  },
  {
    "id": "tofu",
    "name": {
      "en": "Firm tofu",
      "de": "Fester Tofu"
    },
    "parent_id": "soy",
    "flags": [],
    "aisle": {
      "en": "Chilled & dairy",
      "de": "Kühlregal & Milchprodukte"
    }
  },
  {
    "id": "silken-tofu",
    "name": {
      "en": "Silken tofu",
      "de": "Seidentofu"
    },
    "parent_id": "soy",
    "flags": [],
    "aisle": {
      "en": "Chilled & dairy",
      "de": "Kühlregal & Milchprodukte"
    }
  },
  {
    "id": "tempeh",
    "name": {
      "en": "Plain tempeh",
      "de": "Natur-Tempeh"
    },
    "parent_id": "soy",
    "flags": [],
    "aisle": {
      "en": "Chilled & dairy",
      "de": "Kühlregal & Milchprodukte"
    }
  },
  {
    "id": "tamari",
    "name": {
      "en": "Alcohol-free gluten-free tamari",
      "de": "Alkoholfreies glutenfreies Tamari"
    },
    "parent_id": "soy",
    "flags": [],
    "aisle": {
      "en": "Pantry",
      "de": "Vorrat"
    }
  },
  {
    "id": "miso",
    "name": {
      "en": "Alcohol-free rice miso",
      "de": "Alkoholfreies Reis-Miso"
    },
    "parent_id": "soy",
    "flags": [],
    "aisle": {
      "en": "Pantry",
      "de": "Vorrat"
    }
  },
  {
    "id": "edamame",
    "name": {
      "en": "Shelled edamame",
      "de": "Geschälte Edamame"
    },
    "parent_id": "soy",
    "flags": [],
    "aisle": {
      "en": "Chilled & dairy",
      "de": "Kühlregal & Milchprodukte"
    }
  },
  {
    "id": "wheat",
    "name": {
      "en": "Wheat",
      "de": "Weizen"
    },
    "parent_id": null,
    "flags": [
      "gluten",
      "high-fodmap"
    ],
    "aisle": {
      "en": "Pantry",
      "de": "Vorrat"
    }
  },
  {
    "id": "pita",
    "name": {
      "en": "Pita bread",
      "de": "Fladenbrot"
    },
    "parent_id": "wheat",
    "flags": [],
    "aisle": {
      "en": "Bread & bakery",
      "de": "Brot & Backwaren"
    }
  },
  {
    "id": "pasta",
    "name": {
      "en": "Fettuccine",
      "de": "Fettuccine"
    },
    "parent_id": "wheat",
    "flags": [],
    "aisle": {
      "en": "Pantry",
      "de": "Vorrat"
    }
  },
  {
    "id": "ramen-noodles",
    "name": {
      "en": "Wheat ramen noodles",
      "de": "Weizen-Ramennudeln"
    },
    "parent_id": "wheat",
    "flags": [],
    "aisle": {
      "en": "Pantry",
      "de": "Vorrat"
    }
  },
  {
    "id": "flour",
    "name": {
      "en": "Plain flour",
      "de": "Weizenmehl"
    },
    "parent_id": "wheat",
    "flags": [],
    "aisle": {
      "en": "Pantry",
      "de": "Vorrat"
    }
  },
  {
    "id": "bread",
    "name": {
      "en": "Sourdough bread",
      "de": "Sauerteigbrot"
    },
    "parent_id": "wheat",
    "flags": [],
    "aisle": {
      "en": "Bread & bakery",
      "de": "Brot & Backwaren"
    }
  },
  {
    "id": "meat",
    "name": {
      "en": "Meat",
      "de": "Fleisch"
    },
    "parent_id": null,
    "flags": [],
    "aisle": {
      "en": "Meat & fish",
      "de": "Fleisch & Fisch"